<?xml version="1.0" encoding="UTF-8"?>
<!DOCTYPE repository SYSTEM "repository.dtd">
<repository>

  <!-- dom4j pakcage group-->

  <packagegroup name="dom4j">

     <!-- JAXP package -->

     <package name="dom4j" latest="1.0" default="1.0">

       <definition>
        <info>
           <desc>dom4j: the flexible XML framework for Java</desc>
           <href>http://dom4j.org</href>
        </info>

        <versionset>
          <version version="1.0">
            <note>production</note>
            <jar>dom4j-1.0.jar</jar>
            <dependencies>
              <dep version="1.1" package="jaxp-parser"/>
            </dependencies>
          </version>

          <version version="1.0-daily">
            <note>current CVS HEAD</note>
            <jar>dom4j-daily.jar</jar>
            <dependencies>
              <dep version="1.1" package="jaxp-parser"/>
            </dependencies>
          </version>
        </versionset>
       </definition>
      </package>
 
  </packagegroup>

</repository>
